{
  "tactic": "credential",
  "difficulty": 3,
  "sender_name": "HR Shared Services",
  "sender_email": "hr.ss@vantage-partners.example.com",
  "subject": "Self-service password reset required",
  "body": "Our HR system has migrated to a new self-service portal and all employee accounts must be re-verified. Please follow the steps in the portal to set your new password and confirm your recovery email. Your current password will no longer be accepted after the migration window closes. If you experience any issues, use the self-service reset option rather than contacting support, as support volume is limited during migration.",
  "indicators": ["migration story to justify reset", "asks you to re-enter password in a new portal", "discourages contacting real support"],
  "hook": "A system-migration story makes re-entering credentials seem like a normal step."
}